{
  "season": 2026,
  "generated_utc": "2026-10-17T00:21:48Z",
  "current_week": 6,
  "weeks": [
    {
      "week": 1,
      "path": "data/parlays/2026_wk01.json",
      "updated_utc": "2026-09-14T21:46:51Z",
      "archived_utc": "2026-09-15T03:52:07Z",
      "closed": true,
      "n_parlays": 66,
      "n_week_scope": 18,
      "n_game_scope": 48
    },
    {
      "week": 2,
      "path": "data/parlays/2026_wk02.json",
      "updated_utc": "2026-09-22T01:36:34Z",
      "archived_utc": "2026-09-22T10:04:54Z",
      "closed": true,
      "n_parlays": 182,
      "n_week_scope": 73,
      "n_game_scope": 109
    },
    {
      "week": 3,
      "path": "data/parlays/2026_wk03.json",
      "updated_utc": "2026-09-29T02:34:18Z",
      "archived_utc": "2026-09-29T04:45:10Z",
      "closed": true,
      "n_parlays": 138,
      "n_week_scope": 37,
      "n_game_scope": 101
    },
    {
      "week": 4,
      "path": "data/parlays/2026_wk04.json",
      "updated_utc": "2026-10-06T02:57:36Z",
      "archived_utc": "2026-10-06T05:21:46Z",
      "closed": true,
      "n_parlays": 66,
      "n_week_scope": 18,
      "n_game_scope": 48
    },
    {
      "week": 5,
      "path": "data/parlays/2026_wk05.json",
      "updated_utc": "2026-10-13T03:32:09Z",
      "archived_utc": "2026-10-13T05:53:30Z",
      "closed": true,
      "n_parlays": 68,
      "n_week_scope": 23,
      "n_game_scope": 45
    },
    {
      "week": 6,
      "path": "data/parlays/2026_wk06.json",
      "updated_utc": "2026-10-17T00:19:59Z",
      "archived_utc": "2026-10-17T00:21:48Z",
      "closed": false,
      "n_parlays": 60,
      "n_week_scope": 18,
      "n_game_scope": 42
    }
  ]
}
